{
  "$schema": "./ghost-doc-schema.json",
  "documentId": "ghost-autonomy-technical-doc-v1",
  "version": "1.0.0",

  "meta": {
    "title": {
      "fa": "مستندات فنی Ghost Autonomy",
      "en": "Ghost Autonomy Technical Documentation"
    },
    "subtitle": {
      "fa": "معماری PICAPD · Queen Bee · تحمل خطای بیزانسی",
      "en": "PICAPD ISA · Queen Bee Architecture · Byzantine Fault Tolerance"
    },
    "organization": "Ghost Autonomy",
    "confidentiality": "internal",
    "createdAt": "2024-01-01",
    "updatedAt": "2026-02-17",
    "totalParts": 8,
    "totalChapters": 41,
    "sourceFormat": "latex",
    "keywords": [
      "PICAPD ISA", "Queen Bee Architecture", "Byzantine Fault Tolerance",
      "Bilinear Form Mapping", "Population Balance Equations", "Moment Compression",
      "AGM Iteration", "Elliptic Integrals", "ASIL-D", "EPU Silicon",
      "Autonomous Computing", "Physics-Inspired Computing",
      "Sharif University", "IIT Dissertation", "High-Purity Silica",
      "India Semiconductor Mission", "South Korea Semiconductor",
      "Quad-Plus Alliance", "Harmonic Analysis", "Uncertainty Quantification"
    ]
  },

  "i18n": {
    "primaryLanguage": "fa",
    "secondaryLanguage": "en",
    "rtlLanguages": ["fa", "ar"],
    "defaultDisplayLanguage": "en"
  },

  "parts": [
    {
      "id": "executive",
      "type": "part",
      "partNumber": 1,
      "partId": "part:executive",
      "label": { "fa": "اجرایی و استراتژیک", "en": "Executive & Strategic" },
      "slug": "executive-and-strategic",
      "accentColor": "#1A3C6E",
      "chapters": [
        {
          "id": "executive-summary",
          "type": "chapter",
          "chapterNumber": 1,
          "label": { "fa": "خلاصه اجرایی", "en": "Executive Summary" },
          "slug": "executive-summary",
          "allocatePages": false,
          "researchCoverage": false,
          "tags": ["executive"],
          "anchorHash": "#executive-summary",
          "sections": [
            {
              "id": "vision",
              "type": "section",
              "label": { "fa": "چشم‌انداز", "en": "Vision" },
              "slug": "vision",
              "allocatePages": false,
              "tags": ["executive"],
              "anchorHash": "#vision",
              "subsections": [
                {
                  "id": "mathematical-universality",
                  "type": "subsection",
                  "label": { "fa": "جهانی بودن ریاضی", "en": "Mathematical Universality" },
                  "slug": "mathematical-universality",
                  "allocatePages": false,
                  "tags": ["executive", "mathematics"],
                  "anchorHash": "#mathematical-universality"
                },
                {
                  "id": "computational-efficiency",
                  "type": "subsection",
                  "label": { "fa": "کارایی محاسباتی", "en": "Computational Efficiency" },
                  "slug": "computational-efficiency",
                  "allocatePages": false,
                  "tags": ["executive"],
                  "anchorHash": "#computational-efficiency"
                },
                {
                  "id": "physical-validation",
                  "type": "subsection",
                  "label": { "fa": "اعتبارسنجی فیزیکی", "en": "Physical Validation" },
                  "slug": "physical-validation",
                  "allocatePages": false,
                  "tags": ["executive", "physics"],
                  "anchorHash": "#physical-validation"
                }
              ]
            },
            {
              "id": "strategic-goals",
              "type": "section",
              "label": { "fa": "اهداف کلان", "en": "Strategic Goals" },
              "slug": "strategic-goals",
              "allocatePages": false,
              "tags": ["executive", "strategy"],
              "anchorHash": "#strategic-goals",
              "subsections": []
            },
            {
              "id": "value-proposition",
              "type": "section",
              "label": { "fa": "پیشنهاد ارزش", "en": "Value Proposition" },
              "slug": "value-proposition",
              "allocatePages": false,
              "tags": ["executive"],
              "anchorHash": "#value-proposition",
              "subsections": []
            },
            {
              "id": "technical-summary",
              "type": "section",
              "label": { "fa": "خلاصه فنی", "en": "Technical Summary" },
              "slug": "technical-summary",
              "allocatePages": false,
              "tags": ["executive"],
              "anchorHash": "#technical-summary",
              "subsections": [
                {
                  "id": "picapd-isa-architecture",
                  "type": "subsection",
                  "label": { "fa": "معماری PICAPD ISA", "en": "PICAPD ISA Architecture" },
                  "slug": "picapd-isa-architecture",
                  "allocatePages": false,
                  "tags": ["isa", "architecture"],
                  "anchorHash": "#picapd-isa-architecture"
                },
                {
                  "id": "queen-bee-architecture",
                  "type": "subsection",
                  "label": { "fa": "معماری Queen Bee", "en": "Queen Bee Architecture" },
                  "slug": "queen-bee-architecture",
                  "allocatePages": false,
                  "tags": ["architecture"],
                  "anchorHash": "#queen-bee-architecture"
                },
                {
                  "id": "byzantine-fault-tolerance",
                  "type": "subsection",
                  "label": { "fa": "تحمل خطای بیزانسی", "en": "Byzantine Fault Tolerance" },
                  "slug": "byzantine-fault-tolerance",
                  "allocatePages": false,
                  "tags": ["byzantine-fault-tolerance"],
                  "anchorHash": "#byzantine-fault-tolerance"
                }
              ]
            }
          ]
        },
        {
          "id": "market-analysis",
          "type": "chapter",
          "chapterNumber": 2,
          "label": { "fa": "تحلیل بازار", "en": "Market Analysis" },
          "slug": "market-analysis",
          "allocatePages": true,
          "researchCoverage": false,
          "tags": ["market"],
          "anchorHash": "#market-analysis",
          "sections": [
            { "id": "market-size", "type": "section", "label": { "fa": "اندازه بازار", "en": "Market Size" }, "slug": "market-size", "allocatePages": true, "tags": ["market"], "anchorHash": "#market-size", "subsections": [] },
            { "id": "competitive-landscape", "type": "section", "label": { "fa": "رقبا", "en": "Competitive Landscape" }, "slug": "competitive-landscape", "allocatePages": true, "tags": ["market"], "anchorHash": "#competitive-landscape", "subsections": [] },
            { "id": "trends", "type": "section", "label": { "fa": "روندها", "en": "Trends" }, "slug": "trends", "allocatePages": true, "tags": ["market"], "anchorHash": "#trends", "subsections": [] },
            { "id": "opportunities", "type": "section", "label": { "fa": "فرصت‌ها", "en": "Opportunities" }, "slug": "opportunities", "allocatePages": true, "tags": ["market"], "anchorHash": "#opportunities", "subsections": [] }
          ]
        },
        { "id": "product-strategy", "type": "chapter", "chapterNumber": 3, "label": { "fa": "استراتژی محصول", "en": "Product Strategy" }, "slug": "product-strategy", "allocatePages": true, "tags": ["product"], "anchorHash": "#product-strategy", "sections": [] },
        { "id": "competitive-advantage", "type": "chapter", "chapterNumber": 4, "label": { "fa": "مزیت رقابتی", "en": "Competitive Advantage" }, "slug": "competitive-advantage", "allocatePages": true, "tags": ["strategy"], "anchorHash": "#competitive-advantage", "sections": [] },
        { "id": "roadmap", "type": "chapter", "chapterNumber": 5, "label": { "fa": "نقشه راه", "en": "Roadmap" }, "slug": "roadmap", "allocatePages": true, "tags": ["strategy"], "anchorHash": "#roadmap", "sections": [] },
        { "id": "team", "type": "chapter", "chapterNumber": 6, "label": { "fa": "تیم", "en": "Team" }, "slug": "team", "allocatePages": true, "tags": ["executive"], "anchorHash": "#team", "sections": [] },
        { "id": "risk-management-exec", "type": "chapter", "chapterNumber": 7, "label": { "fa": "مدیریت ریسک", "en": "Risk Management" }, "slug": "risk-management-exec", "allocatePages": true, "tags": ["risk"], "anchorHash": "#risk-management-exec", "sections": [] }
      ]
    },

    {
      "id": "philosophy",
      "type": "part",
      "partNumber": 2,
      "partId": "part:philosophy",
      "label": { "fa": "فلسفه طراحی و مفهوم‌سازی", "en": "Philosophy, Design & Conception (PDC)" },
      "slug": "philosophy-design-conception",
      "accentColor": "#4B3F72",
      "chapters": [
        {
          "id": "pdc",
          "type": "chapter",
          "chapterNumber": 8,
          "label": { "fa": "فلسفه طراحی و مفهوم‌سازی (PDC)", "en": "Philosophy, Design & Conception (PDC)" },
          "slug": "pdc",
          "allocatePages": false,
          "researchCoverage": false,
          "tags": ["design-principles", "philosophy"],
          "anchorHash": "#pdc",
          "sections": [
            {
              "id": "motivation-scope-reader-contract",
              "type": "section",
              "label": { "fa": "انگیزه، دامنه و قرارداد خواننده", "en": "Motivation, Scope, and the Reader Contract" },
              "slug": "motivation-scope-reader-contract",
              "allocatePages": false,
              "tags": ["philosophy"],
              "anchorHash": "#motivation-scope-reader-contract",
              "subsections": [